Year,FileName,Title,Citation Count
2011,2011_5_5,"Peer review in academic promotion and publishing: Its meaning, locus, and future",2
2011,2011_5_6,"Great expectatrics: Great papers, great journals, great econometrics",46
2011,2011_5_7,A methodology for Institution-Field ranking based on a bidimensional analysis: the IFQ 2 A index,44
2011,2011_5_8,h-Degree as a basic measure in weighted networks,49
2011,2011_5_9,How to create an innovation accelerator,45
2011,2011_5_10,A Hirsch-type index of co-author partnership ability,47
2011,2011_6_1,Comparing the expert survey and citation impact journal ranking methods: Example from the field of Artificial Intelligence,55
2011,2011_6_2,A field-standardized application of DEA to national-scale research assessment of universities,51
2011,2011_6_3,Thoughts on uncitedness: Nobel laureates and Fields medalists as case studies,48
2011,2011_6_4,Measuring user influence on twitter using modified k-shell decomposition,4
2011,2011_6_5,Where are we in the “long march to legitimacy?” Assessing scholarship in management learning and education,49
2011,2011_6_6,A statistical picture of popularization activities and their evolutions in France,51
2011,2011_6_7,Top-cited articles in endodontic journals,53
2011,2011_6_8,"What makes a great journal great in the sciences? Which came first, the chicken or the egg?",40
2011,2011_6_9,On measuring scholarly influence by citations,40
2011,2011_6_10,A survey on IT-governance aspects of cloud computing,37
2011,2011_7_1,The h index of the presidents of the American Psychological Association (APA) through journal articles included in the Web of Science database,38
2011,2011_7_2,An evaluation of the Australian Research Council's journal ranking,46
2011,2011_7_3,Bibliometric rankings of journals based on impact factors: An axiomatic approach,37
2011,2011_7_4,Scholarly productivity of United States academic cardiothoracic anesthesiologists: influence of fellowship accreditation and transesophageal echocardiographic  …,42
2011,2011_7_5,A combined bibliometric indicator to predict article impact,44
2011,2011_7_6,Urology resident publication output and its relationship to future academic achievement,39
2011,2011_7_7,Scientific output and its relationship to knowledge economy: an analysis of ASEAN countries,47
2011,2011_7_8,Mixed-indicators model for identifying emerging research areas,45
2011,2011_7_9,Bibliometric analysis of anaesthesia journal editorial board members: correlation between journal impact factor and the median h-index of its board members,39
2011,2011_7_10,Ranking scientists and departments in a consistent manner,40
2011,2011_8_1,Weighted indices for evaluating the quality of research with multiple authorship,39
2011,2011_8_2,The measurement of low-and high-impact in citation distributions: Technical results,39
2011,2011_8_3,Successful papers: A new idea in evaluation of scientific output,42
2011,2011_8_4,Fairly sharing the credit of multi-authored papers and its application in the modification of h-index and g-index,39
2011,2011_8_5,Application of the distribution of citations among publications in scientometric evaluations,27
2011,2011_8_6,"How are journal impact, prestige and article influence related? An application to neuroscience",34
2011,2011_8_7,The effect of academic inbreeding on scientific effectiveness,41
2011,2011_8_8,"h-Indices in a university department of anaesthesia: an evaluation of their feasibility, reliability, and validity as an assessment of academic performance",37
2011,2011_8_9,Quality versus quantity: assessing individual research performance,42
2011,2011_8_10,A bibliometric index based on the collaboration distance between cited and citing authors,35
2011,2011_9_1,Central indexes to the citation distribution: A complement to the h-index,31
2011,2011_9_2,The h index as a research performance indicator,38
2011,2011_9_3,Accuracy of inter-researcher similarity measures based on topical and social clues,37
2011,2011_9_4,The j-index: a new bibliometric index and multivariate comparisons between other common indices,37
2011,2011_9_5,Evaluating university research performance using metrics,34
2011,2011_9_6,Development of computer science disciplines: a social network analysis approach,32
2011,2011_9_7,Measuring economic journals' citation efficiency: a data envelopment analysis approach,33
2011,2011_9_8,Evaluating the productivity of social work scholars using the h-index,38
2011,2011_9_9,What's familiar is excellent: The impact of exposure effect on perceived journal quality,34
2011,2011_9_10,Defining success for translational research organizations,35
2011,2011_10_1,The demise of the ARC journal ranking scheme: an ex post analysis of the accounting and finance journals,34
2011,2011_10_2,"Quasity, when quantity has a quality all of its own—toward a theory of performance",36
2011,2011_10_3,Ranking hepatologists: which Hirsch's h-index to prevent the “e-crise de foi-e”?,27
2011,2011_10_4,The diffusion of H-related literature,28
2011,2011_10_5,The association between four citation metrics and peer rankings of research influence of Australian researchers in six fields of public health,34
2011,2011_10_6,Co-authorship networks in electronic markets research,33
2011,2011_10_7,A simple index for the high-citation tail of citation distribution to quantify research performance in countries and institutions,30
2011,2011_10_8,Interdisciplinary research and academic sustainability: managing knowledge in an age of accountability,30
2011,2011_10_9,Bibliometrics of anaesthesia researchers in the UK,28
2011,2011_10_10,On the correlation between bibliometric indicators and peer review: reply to Opthof and Leydesdorff,25
2011,2011_11_1,Biology needs a modern assessment system for professional productivity,28
2011,2011_11_2,Dbischolar: An iphone application for performing citation analyses,24
2011,2011_11_3,Comparison of Brazilian researchers in clinical medicine: are criteria for ranking well-adjusted?,25
2011,2011_11_4,High-and low-impact citation measures: empirical applications,28
2011,2011_11_5,Counting citations in texts rather than reference lists to improve the accuracy of assessing scientific contribution,32
2011,2011_11_6,Analysis of publications on sturgeon research between 1996 and 2010,26
2011,2011_11_7,Informed peer review and uninformed bibliometrics?,25
2011,2011_11_8,A unification of three models for the h?index,30
2011,2011_11_9,Ranking patent assignee performance by h-index and shape descriptors,26
2011,2011_11_10,Tailor based allocations for multiple authorship: a fractional gh-index,26
2011,2011_12_1,The h index and the identification of global benchmarks for breast cancer research output,26
2011,2011_12_2,"Research: metrics, quality, and management implications",29
2011,2011_12_3,Structured evaluation of the scientific output of academic research groups by recent h-based indicators,26
2011,2011_12_4,How to judge a book by its cover? How useful are bibliometric indices for the evaluation of “scientific quality” or “scientific productivity”?,24
2011,2011_12_5,The scholarly influence of Heinz Klein: ideational and social measures of his impact on IS research and IS scholars,29
2011,2011_12_6,The power of multiple methods and evidence sources: Raising the profile of Canadian counselling psychology research.,21
2011,2011_12_7,Mining typical features for highly cited papers,26
2011,2011_12_8,"Thought exercises on accountability and performance measures at the National Heart, Lung, and Blood Institute (NHLBI): an invited commentary for circulation  …",22
2011,2011_12_9,"Measuring the visibility of the university's scientific production through scientometric methods: an exploratory study at the Transilvania University of Brasov, Romania",23
2011,2011_12_10,Citation searching and bibliometric measures resources for ranking and tracking,25
2011,2011_13_1,Assessing the scholarly impact of imageclef,24
2011,2011_13_2,The Hirsch index-a play on numbers or a true appraisal of academic output?,22
2011,2011_13_3,Ranking strategy for graduate programs evaluation,28
2011,2011_13_4,Are the h-index and some of its alternatives discriminatory of epistemological beliefs and methodological preferences of faculty members? The case of social scientists …,23
2011,2011_13_5,What does the g?index really measure?,25
2011,2011_13_6,Scholarship of teaching international business: Challenges and opportunities,23
2011,2011_13_7,The most cited works in major depression: the 'Citation classics',25
2011,2011_13_8,Can scientific quality be quantified?,23
2011,2011_13_9,Comparison of universities' scientific performance using bibliometric indicators,33
2011,2011_13_10,Strange attractors in the Web of Science database,19
2011,2011_14_1,Possibilistic analysis of arity-monotonic aggregation operators and its relation to bibliometric impact assessment of individuals,19
2011,2011_14_2,"The h-index, h-core citation rate and the bibliometric profile of the Scopus database",24
2011,2011_14_3,"Economic Principles of State Aid Control Justus Haucap, Ulrich Schwalbe",14
2011,2011_14_4,"The research productivity of academic psychologists: assessment, trends, and best practice recommendations",24
2011,2011_14_5,Credit where credit's due: accounting for co-authorship in citation counts,21
2011,2011_14_6,Visibility of medical informatics regarding bibliometric indices and databases,19
2011,2011_14_7,Methods for detrending success metrics to account for inflationary and deflationary factors,18
2011,2011_14_8,Positioning research and innovation performance using shape centroids of h-core and h-tail,20
2011,2011_14_9,How should research performance be measured? A study of Swedish economists,21
2011,2011_15_1,Bibliometric impact assessment with R and the CITAN package,20
2011,2011_15_2,Probing the effect of author self-citations on h index: A case study of environmental engineering,20
2011,2011_15_3,"Towards a novel unified framework for developing formal, network and validated agent-based simulation models of complex adaptive systems",28
2011,2011_15_4,The calculation of the single publication h index and related performance measures: A web application based on Google Scholar data,21
2011,2011_15_5,Bibliometric data in clinical cardiology revisited. The case of 37 Dutch professors,19
2011,2011_15_6,The H-Index as a quantitative indicator of the relative impact of human diseases,22
2011,2011_15_7,A publication index that is independent of age,17
2011,2011_15_8,An impact-citations-exergy (iCX) trajectory analysis of leading research institutions in India,21
2011,2011_15_9,Successful management of research & development,0
2011,2011_15_10,Time-aware ranking in dynamic citation networks,23
2011,2011_16_1,Bibliometric indicators and core journals in physical and rehabilitation medicine,20
2011,2011_16_2,Axiomatics for the Hirsch index and the Egghe index,19
2011,2011_16_3,Differences in citation frequency of clinical and basic science papers in cardiovascular research,19
2011,2011_16_4,Assessing researcher publication productivity in the leading information systems journals: A 2005–2009 update,21
2011,2011_16_5,Proposals for evaluating the regularity of a scientist's research output,15
2011,2011_16_6,Journal quality metrics: Options to consider other than impact factors,24
2011,2011_16_7,Learning to rank for expert search in digital libraries of academic publications,23
2011,2011_16_8,An efficient algorithm for ranking research papers based on citation network,18
2011,2011_16_9,Methodological quality and scientific impact of quantitative nursing education research over 18 months,20
2011,2011_16_10,Mapping the development of scientometrics: 2002 to 2008,18
2011,2011_17_1,Who is going to win the next Association for the Advancement of Artificial Intelligence Fellowship Award? Evaluating researchers by mining bibliographic data,15
2011,2011_17_2,Intellectual structure and infrastructure of informetrics: Domain analysis from 2001 to 2010,21
2011,2011_17_3,Environmental versatility promotes modularity in genome-scale metabolic networks,16
2011,2011_17_4,"A comment to the paper by Waltman et al., Scientometrics, 87, 467–481, 2011",17
2011,2011_17_5,Bibliometric awareness in nursing scholarship: Can we afford to ignore it any longer?,19
2011,2011_17_6,Specific character of citations in historiography (using the example of Polish history),17
2011,2011_17_7,"Do impact factor, h-index and Eigenfactor (TM) of chemical engineering journals correlate well with each other and indicate the journals' influence and prestige?",19
2011,2011_17_8,The skewness of computer science,16
2011,2011_17_9,Evolución de la literatura sobre empresa familiar como disciplina científica,0
2011,2011_17_10,To measure is to know: an approach to CADD performance metrics,16
2011,2011_18_1,Optimal dimensionality reduction of complex dynamics: the chess game as diffusion on a free-energy landscape,14
2011,2011_18_2,Results of a citation analysis of knowledge management in education,21
2011,2011_18_3,Bibliometric positioning of scientific manufacturing journals: a comparative analysis,12
2011,2011_18_4,Further characterizations of the Hirsch index,15
2011,2011_18_5,Measuring faculty productivity,21
2011,2011_18_6,A proposal for a first-citation-speed-index,18
2011,2011_18_7,Research productivity and impact of ASEAN countries and universities in the field of energy and fuel,12
2011,2011_18_8,Editorial: Quality is better than quantity when it comes to publications,13
2011,2011_18_9,The geography of distance education-bibliographic characteristics of a journal network,18
2011,2011_19_1,Expertise Recommender System for Scientific Community.,18
2011,2011_19_2,"Citation analysis of The Korean Journal of Internal Medicine from KoMCI, Web of Science, and Scopus",14
2011,2011_19_3,Where do Italian universities stand? An in-depth statistical analysis of national and international rankings,13
2011,2011_19_4,On first quartile journals which are not of highest impact,12
2011,2011_19_5,On the growth of citations of publication output of individual authors,11
2011,2011_19_6,Author self-citations in the field of ecology,11
2011,2011_19_7,Categorizing h-index variants,12
2011,2011_19_8,The intellectual influence of entrepreneurship journals: A network analysis,13
2011,2011_19_9,??????????????????,42
2011,2011_19_10,How and where the TeraGrid supercomputing infrastructure benefits science,11
2011,2011_20_1,Empirical study of the growth dynamics in real career h-index sequences,12
2011,2011_20_2,Trends in authorship order in biomedical research publications,13
2011,2011_20_3,What's in a name? Using informetric techniques to conceptualize the knowledge of traditional and indigenous communities,10
2011,2011_20_4,Some economic aspects of the scholarly journal system,14
2011,2011_20_5,Using Bayesian networks to discover relationships between bibliometric indices. A case study of computer science and artificial intelligence journals,12
2011,2011_20_6,Academic research policy-making and evaluation using graph visualisation,12
2011,2011_20_7,Medical school and residency influence on choice of an academic career and academic productivity among neurosurgery faculty in the United States: Clinical article,0
2011,2011_20_8,Micro-credits in scientific publishing,11
2011,2011_20_9,Disciplinary reach: Investigating the impact of dataset reuse in the earth sciences,13
2011,2011_20_10,How honest is the h-index in measuring individual research output?,10
2011,2011_21_1,"Analytic model for academic research productivity having factors, interactions and implications",14
2011,2011_21_2,Making sense of bibliometrics,10
2011,2011_21_3,Self-enhancement in scientific research: The self-citation bias,9
2011,2011_21_4,Social Networks of Researchers and Educators on nanoHUB. org,10
2011,2011_21_5,Editorial: Citation analysis–focus on leading Australian nurse authors,11
2011,2011_21_6,A shapley value approach for influence attribution,12
2011,2011_21_7,"Influence of database mistakes on journal citation analysis: remarks on the paper by Franceschini and Maisano, QREI (2010)",8
2011,2011_21_8,Using web-mining for academic measurement and scholar recommendation in expert finding system,11
2011,2011_21_9,A bibliometric study of Video Retrieval Evaluation Benchmarking (TRECVid): A methodological analysis,11
2011,2011_21_10,How to measure the impact of chemistry on the small screen,11
2011,2011_22_1,Estudios bibliométricos como línea de investigación en las ciencias biomédicas: una aproximación para el pregrado,27
2011,2011_22_2,"Using citation analysis methods to assess the influence of science, technology, engineering, and mathematics education evaluations",13
2011,2011_22_3,"Enhancement of PCR amplification of actinobacterial 16S rRNA gene using an adjuvant, dimethyl sulphoxide",9
2011,2011_22_4,The Carbon_h-factor: predicting individuals' research impact at early stages of their career,9
2011,2011_22_5,Citations to papers from Brazilian institutions: a more effective indicator to assess productivity and the impact of research in graduate programs,10
2011,2011_22_6,Perspectives from early career researchers on the publication process in ecology–a response to Statzner & Resh (2010),11
2011,2011_22_7,Research performance of RAS institutions and Russian universities: A comparative bibliometric analysis,13
2011,2011_22_8,Comprehensive citation index for research networks,9
2011,2011_22_9,A bibliometric analysis of diarrhoeal disease research in Bangladesh,9
2011,2011_22_10,The effects of co-citation proximity on co-citation analysis,12
2011,2011_23_1,Does the h index for assessing single publications really work? A case study on papers published in chemistry,9
2011,2011_23_2,Index of articles H-citing: a contribution to the evaluation of scientific production of experienced researchers,12
2011,2011_23_3,Negotiation on the assessment of research articles with academic reviewers: application of peer-review approach of teaching,9
2011,2011_23_4,Evaluation metrics for biostatistical and epidemiological collaborations,8
2011,2011_23_5,Citation analysis of Australia?trained optometrists,8
2011,2011_23_6,Scientometric analysis of physics (1979–2008): A quantitative description of scientific impact,9
2011,2011_23_7,Using the impact factor and H index to assess researchers and publications,21
2011,2011_23_8,Indicadores bibliométricos em ciência da informação: análise dos pesquisadores mais produtivos no tema estudos métricos na base Scopus,28
2011,2011_23_9,?????????????,31
2011,2011_24_1,A methodology for calculating prestige ranks of academic journals in communication: A more inclusive alternative to citation metrics,7
2011,2011_24_2,On the analogy between the evolution of thermodynamic and bibliometric systems: a breakthrough or just a bubble?,6
2011,2011_24_3,Axiomatic characterizations of (quasi-) L-statistics and S-statistics and the Producer Assessment Problem.,7
2011,2011_24_4,Characterizations of the generalized Wu-and Kosmulski-indices in Lotkaian systems,8
2011,2011_24_5,"Historical, conceptual, and methodological aspects of the publications of the Brazilian Symposium on Software Engineering: a systematic mapping study",7
2011,2011_24_6,A thermodynamic explanation for the Glänzel–Schubert model for the h?index,7
2011,2011_24_7,One hundred vascular surgery citation “classics” from the surgical literature,9
2011,2011_24_8,Research contributions of Spanish Psychiatry (2004-2009): A bibliometric analysis of a University department,9
2011,2011_25_1,"The h-index, h-core citation rate and the bibliometric profile of the Web of Science database in three configurations",9
2011,2011_25_2,"Re-use as Impact: How re-assessing what we mean by 'impact'can support improving the return on public investment, develop open research practice, and  …",7
2011,2011_25_3,H-index of Collective Health professors in Brazil,7
2011,2011_25_4,"Total NIH support to US dental schools, 2005-2009",8
2011,2011_25_5,2009 ?????????????????,18
2011,2011_25_6,"??????, h ??, ?? h ?????????????",19
2011,2011_25_7,"Das loucuras da razão ao sexo dos anjos: biopolítica, hiperprevenção, produtividade científica",25
2011,2011_25_8,Tracking the careers of academic general pediatric fellowship program graduates: academic productivity and leadership roles,5
2011,2011_25_9,Scanning probe methods: from microscopy to sensing,7
2011,2011_25_10,Research Ethics for Scientists: A Companion for Students,0
2011,2011_26_1,Evaluation of valuable user generated content on social news web sites,7
2011,2011_26_2,Research performance of top engineering and technological institutes of India: A comparison of indices,7
2011,2011_26_3,Medical school and residency influence on choice of an academic career and academic productivity among US neurology faculty,7
2011,2011_26_4,Telescope bibliometrics 101,6
2011,2011_26_5,WHEN LESS IS MORE: EFFECTS OF GRADE SKIPPING ON ADULT STEM ACCOMPLISHMENTS AMONG MATHEMATICALLY PRECOCIOUS ADOLESCENTS,1549
2011,2011_26_6,Clustering of distributions: A case of patent citations,6
2011,2011_26_7,Qualifying scholarly impact using an iCX (impact-Citations-Exergy) analysis,8
2011,2011_26_8,An index-based measure of university technology transfer,6
2011,2011_26_9,A simple impact measure and its evolution over time,6
2011,2011_26_10,Prominence ranking in graphs with community structure,7
2011,2011_27_1,h-?????????????,19
2011,2011_27_2,Visibilidad de las revistas latinoamericanas de bibliotecología y ciencia de la informacióna través de Google Scholar,15
2011,2011_27_3,???????????????,16
2011,2011_27_4,???????????????????????,15
2011,2011_27_5,?????? Amazon Kindle ???????,13
2011,2011_27_6,h ????????????????,15
2011,2011_27_7,Counting methods & university ranking by H?index,6
2011,2011_27_8,Higher education area: redefining European education borders,5
2011,2011_27_9,Research trends in fusion engineering: a global perspective,6
2011,2011_27_10,Analyzing information systems researchers' productivity and impacts: A perspective on the H index,6
2011,2011_28_1,The athletes of science,6
2011,2011_28_2,Optical and vibrational properties of self-assembled GaN quantum dots,5
2011,2011_28_3,The kinship or k-index as an antidote against the toxic effects of h-indices,7
2011,2011_28_4,The Matthew effect and a relation with concept symbols and defaults,6
2011,2011_28_5,Citations and impact of ISI tourism and hospitality journals,5
2011,2011_28_6,BULGARIAN CONTRIBUTION TO WORLD SCIENCE AND MAIN CRITERIA FOR ASSESSING THE ACHIEVEMENTS OF SCIENTISTS.,5
2011,2011_28_7,???????? 2010 ??????????——???????????????????,13
2011,2011_28_8,???????? ?????????????-?????????? ? ??????????????? ??????,0
2011,2011_28_9,??????? ?????,22
2011,2011_28_10,Análisis del índice-h y propuesta de un nuevo índice bibliométrico: el índice global,14
2011,2011_29_1,Aplicación empírica de un indicador bibliométrico basado en el índice h,8
2011,2011_29_2,Análisis bibliométrico de la revista Bordón,10
2011,2011_29_3,??????——h ??????,10
2011,2011_29_4,h ????????????????,13
2011,2011_29_5,Peer review: beyond the call of duty?,5
2011,2011_29_6,Research in pharmacy schools of India: A study based on Scopus database,5
2011,2011_29_7,A decade of database research publications: a look inside,5
2011,2011_29_8,Fields of interest and influence: a new method for sourcing and ranking journals in psychiatry,4
2011,2011_29_9,Is collaboration creative or costly? Exploring tradeoffs in the organization of knowledge work,5
2011,2011_29_10,Development of an iPhone business application,4
2011,2011_30_1,The Hirsch index: more than a number?,5
2011,2011_30_2,Social capital and individual performance: a study of academic collaboration,7
2011,2011_30_3,Scientometric Portrait of Dr. Atta-ur-Rahman,5
2011,2011_30_4,Examining scholarly influence: a study in Hirsch metrics and social network analysis,7
2011,2011_30_5,Bibliometrics and assessing performance and worth,5
2011,2011_30_6,Who are the research disciples of an author? Examining publication recitation and oeuvre citation exhaustivity,4
2011,2011_30_7,Real-time geo influence in social networks,6
2011,2011_30_8,Journal self-citation analysis of some Chinese sci-tech periodicals,6
2011,2011_30_9,Learning to rank academic experts,6
2011,2011_31_1,An index to evaluate fund and fund manager performance,4
2011,2011_31_2,h ???????????????????,8
2011,2011_31_3,H ????????????????——?? ????? ????,9
2011,2011_31_4,"Ciencia y Género en Cuba (Web of Science, 2001-2007)",8
2011,2011_31_5,Sistemi di governo e di valutazione della performance per l'azienda «Università»,21
2011,2011_31_6,???????????????????,8
2011,2011_31_7,???????? h ??????: ?????,8
2011,2011_31_8,??????????????????,10
2011,2011_31_9,????????????????????,8
2011,2011_31_10,????????????????——?? h ??? g ??????,9
2011,2011_32_1,"ESTEEM INDICATORS: MEMBERSHIP IN EDITORIAL BOARDS OR HONORARY DOCTORATES-DISCUSSION OF"" QUANTITATIVE AND QUALITATIVE RANKINGS  …",5
2011,2011_32_2,The “masterpieces of scientific creativity”: An analysis of highly cited papers by Russian scientists,4
2011,2011_32_3,Predicting the h-index with cost-sensitive naive Bayes,3
2011,2011_32_4,Impact functions on the citation network of scientific articles,2
2011,2011_32_5,A Scientific Resource Space for Advanced Research Evaluation Scenarios.,3
2011,2011_32_6,Charting a Course for a Successful Research Career,4
2011,2011_32_7,The Bt brinjal–biodiversity issue,2
2011,2011_32_8,Astronomy libraries–Your gateway to information,4
2011,2011_32_9,Citation analysis cannot legitimate the strategic selection of excellence,4
