Year,FileName,Title,Citation Count
2013,2013_22_2,The suitability of h and g indexes for measuring the research performance of institutions,12
2013,2013_22_3,What do experts know about forecasting journal quality? A comparison with ISI research impact in finance,8
2013,2013_22_4,Quality of research: which underlying values?,9
2013,2013_22_5,Bibliometric analysis of South American research in sports science from 1970 to 2012,8
2013,2013_22_6,Paradigmatic approaches used in enterprise resource planning systems research: A systematic literature review,8
2013,2013_22_7,Ranking leading econometrics journals using citations data from ISI and RePEc,10
2013,2013_22_8,"OM3: Ordered Maxitive, Minitive, and Modular Aggregation Operators: Axiomatic Analysis under Arity-Dependence (I)",7
2013,2013_22_9,"Ratios of h-cores, h-tails and uncited sources in sets of scientific papers and technical patents",10
2013,2013_22_10,Equal contributions and credit: an emerging trend in the characterization of authorship in major anaesthesia journals during a 10-yr period,8
2013,2013_23_1,A bibliometric review of the first thirty years of the Journal of Environmental Psychology,10
2013,2013_23_2,The challenges of evaluating scientists by H-index and citations in different biomedical research platforms.,8
2013,2013_23_3,"Ranking faculties, Ph. D. programs, individual scholars, and influential articles in accounting information systems based on citations to publications in the Journal of  …",0
2013,2013_23_4,Predicting citation counts using text and graph mining,12
2013,2013_23_5,The top 100 cited articles in essential tremor,11
2013,2013_23_6,Year-based h-type indicators,9
2013,2013_23_7,"OM3: ordered maxitive, minitive, and modular aggregation operators. a simulation study (II)",7
2013,2013_23_8,Comparing the reputation of researchers using a profile model and scientific metrics,8
2013,2013_23_9,An empirical investigation of the influence of collaboration in Finance on article impact,15
2013,2013_23_10,A citation analysis of nurse education journals using various bibliometric indicators,10
2013,2013_24_1,Citation opportunity cost of the high impact factor obsession,8
2013,2013_24_2,Quantifying reviewer credibility in online tourism,9
2013,2013_24_3,Avaliação de produção científica de pesquisadores: mapeamento das publicações científicas,24
2013,2013_24_4,"??????????????, ????????——?? 17 ???????????????",37
2013,2013_24_5,Bibliometric indicators: why do we need more than one?,10
2013,2013_24_6,Digital scholarship: exploration of strategies and Skills for knowledge creation and dissemination,9
2013,2013_24_7,Methods to increase research output: some tips looking at the MENA region,9
2013,2013_24_8,Analyzing the flow of ideas and profiles of contributors in an open learning community,5
2013,2013_24_9,"Building on and honoring forty years of PBL scholarship from Howard Barrows: A scientometric, large-scale data, and visualization-based analysis",8
2013,2013_24_10,Advice to a young researcher: with reminiscences of a life in science,6
2013,2013_25_1,"Peer review, citation ratings and other fetishes",7
2013,2013_25_2,The H-index can be easily manipulated,8
2013,2013_25_3,Comparative rank assessment of journal articles,9
2013,2013_25_4,On the measurement and benchmarking of research impact among active logistics scholars,8
2013,2013_25_5,Impact of funding on scientific output and collaboration: A survey of literature,7
2013,2013_25_6,Research in congenital heart disease: a comparative bibliometric analysis between developing and developed countries,8
2013,2013_25_7,"India's contribution on"" Guillain-Barre syndrome"": mapping of 40 years research",9
2013,2013_25_8,???????????????,16
2013,2013_25_9,Czy mo?na porównywa? jab?ka i gruszki? O danych bibliometrycznych w ró?nych dziedzinach nauki,17
2013,2013_25_10,Zum Verhältnis von Spitzenforschung und Politikberatung: Eine empirische Analyse vor dem Hintergrund des Ökonomenstreits,16
2013,2013_26_1,La manufacture de l'évaluation scientifique,21
2013,2013_26_2,????????????? ???? ?? ?? ????????? ????????? (??????? ?. ??????????? ?????????????? ?????????????? ???),0
2013,2013_26_3,????? ?? ????????? ???? ?????? ?? ????????????????? ????????????,27
2013,2013_26_4,Revistas iberoamericanas de Psicología indexadas en el Journal Citation Reports de 2011,0
2013,2013_26_5,"Perfil bibliométrico ISI de la Facultad de Odontología de la Universidad de Concepción, 1989-2012.",17
2013,2013_26_6,Using link prediction to estimate the collaborative influence of researchers,7
2013,2013_26_7,Identifying transformative scientific research,6
2013,2013_26_8,Two simple new bibliometric indexes to better evaluate research in disciplines where publications typically receive less citations,10
2013,2013_26_9,Iberian universities: a characterisation from ESI rankings,7
2013,2013_27_1,Research performance of Turkish astronomers in the period of 1980–2010,7
2013,2013_27_2,A bibliometric study of taxonomic botany,8
2013,2013_27_3,A proposal for a novel impact factor as an alternative to the JCR impact factor,10
2013,2013_27_4,Stop-words in keyphrase extraction problem,12
2013,2013_27_5,Suborganizations of institutions in library and information science journals,6
2013,2013_27_6,Promoting Stewardship of Academic Productivity in Emergency Medicine: Using the H?index to Advance Beyond the Impact Factor,5
2013,2013_27_7,Comprehensive geometrical interpretation of h-type indices,6
2013,2013_27_8,Leveraging social relevance: Using social networks to enhance literature access and microblog search,5
2013,2013_27_9,Methodology for evaluating citation parsing and matching,5
2013,2013_27_10,Gender bias and explanation models for the phenomenon of women's discriminations in research careers,7
2013,2013_28_1,"Information, knowledge and the gatekeeper",4
2013,2013_28_2,"Bibliometric approach to research assessment: Publication count, citation count, & author rank",5
2013,2013_28_3,Statistical hypothesis test for the difference between Hirsch indices of two Pareto-distributed random samples,5
2013,2013_28_4,Academic performance indicators for departments of geography in the United States and Canada,6
2013,2013_28_5,Reverse-engineering conference rankings: what does it take to make a reputable conference?,7
2013,2013_28_6,Lifting the fog of scientometric research artifacts: On the scientometric analysis of environmental tobacco smoke research,5
2013,2013_28_7,Efficiency analysis of forestry journals: Suggestions for improving journals' quality,7
2013,2013_28_8,Career track of Society of University Surgeons Resident Research Award recipients,5
2013,2013_28_9,On the correction of the h-index for career length,7
2013,2013_28_10,Mapping the organization: a bibliometric analysis of nurses' contributions to the literature,6
2013,2013_29_1,Family-tree of bibliometric indices,9
2013,2013_29_2,H-indices of academic pediatricians of mashhad university of medical sciences,5
2013,2013_29_3,"Correlation between variables subject to an order restriction, with application to scientometric indices",6
2013,2013_29_4,Generación de un algoritmo de ranking para documentos científicos del área de las ciencias de la computación,12
2013,2013_29_5,????? ???????????????? ??????????? ??? ?????? ?????-????????? ???????????? ???????,32
2013,2013_29_6,Avaliação de bolsas de produtividade do CNPq e medidas bibliométricas: correlações para todas as grandes áreas,0
2013,2013_29_7,Type Extension Trees for feature construction and learning in relational domains,4
2013,2013_29_8,Diabetes mellitus in South Asia: Scientific evaluation of the research output (?????? ??????????),5
2013,2013_29_9,Research Excellence Milestones of BRIC and N-11 countries,4
2013,2013_29_10,Measuring the impact factor of individual researchers in biomedical disciplines.,5
2013,2013_30_1,The h-index: A case of the tail wagging the dog?,4
2013,2013_30_2,Mathematical characterizations of the Wu-and Hirsch-indices using two types of minimal increments.,4
2013,2013_30_3,The development of computer science research in the People's Republic of China 2000–2009: a bibliometric study,6
2013,2013_30_4,Cross-field evaluation of publications of research institutes using their contributions to the fields' MVPs determined by h-index,4
2013,2013_30_5,Citation-paper rank distributions and associated scientometric indicators–a survey,4
2013,2013_30_6,A rationale for the relation between the citer h-index and the classical h-index of a researcher,6
2013,2013_30_7,The Clinical Relevance of Information Index (CRII): assessing the relevance of health information to the clinical practice,10
2013,2013_30_8,The excess-tail ratio: correcting journal impact factors for citation distributions,6
2013,2013_30_9,'Open for business': Do open-access psychiatry journals provide value for money?,4
2013,2013_30_10,The use of the Hirsch index in benchmarking hepatic surgery research,7
2013,2013_31_1,Malleable access rights to establish and enable scientific collaboration,6
2013,2013_31_2,Paper-based productivity ranking of Chilean forestry institutions,0
2013,2013_31_3,Lobby index as a network centrality measure,12
2013,2013_31_4,Users beware: implications of database errors when assessing the individual research records of ecologists and conservation biologists,7
2013,2013_31_5,The propagation and dispersal of misinformation in ecology: Is there a relationship between citation accuracy and journal impact factor?,6
2013,2013_31_6,Refining research citations through context analysis,4
2013,2013_31_7,Mapping the research productivity and scholarly impact of the traditional medicine scholars in Tanzania: a scientometric study,7
2013,2013_31_8,h ??????????????,16
2013,2013_31_9,Pozycja nauki polskiej w mi?dzynarodowych rankingach,12
2013,2013_31_10,"First record of Lonchophylla Peracchii Dias, Esbérard and Moratelli, 2013 (Chiroptera, Phyllostomidae) in São Paulo State, Southeastern Brasil",0
2013,2013_32_1,"?????????, ?????????",11
2013,2013_32_2,h ???????????????——??? “211 ??” ?????????,9
2013,2013_32_3,??? ????? ???? ????? ??? ??,11
2013,2013_32_4,???????????????? ?????????? ? ??????? ??????????? ????? ? ?????? ????????????? ??????? ???????????? ?????,12
2013,2013_32_5,A bibliometric analysis of an international research ethics trainee program,3
2013,2013_32_6,Note on a possible decomposition of the h?Index,6
2013,2013_32_7,A bibliometric study of literature on celiac disease,3
2013,2013_32_8,Give me a hi-5! An additional version of the h-index,3
2013,2013_32_9,How is HRD doing in research and publications? An assessment of journals by AHRD (2005-2011),6
2013,2013_32_10,Application of scientific metrics to evaluate academic reputation in different research areas,4
2013,2013_33_1,The Relevance of the “h?” and “g?” Index to Economics in the Context of A Nation?Wide Research Evaluation Scheme: The New Zealand Case,4
2013,2013_33_2,Research productivity and scholarly impact of forestry researchers at sokoine university of Agriculture: a bibliometric analysis,5
2013,2013_33_3,Evolution of the publications in clinical neurology: scientific impact of different countries during the 2000–2009 period,3
2013,2013_33_4,A Scientometrics Study of Rough Sets in Three Decades.,7
2013,2013_33_5,iHypR: Prominence ranking in networks of collaborations with hyperedges 1,5
2013,2013_33_6,Comparison of independent research of China's top universities using bibliometric indicators,8
2013,2013_33_7,Investigating the universal distributions of normalized indicators and developing field-independent index,3
2013,2013_33_8,Measuring and anticipating the impact of data reuse,8
2013,2013_33_9,Inconsistencies in the highly cited publications indicator,3
2013,2013_33_10,Optimizing research progress trajectories with semantic power graphs,4
2013,2013_34_1,On the time dependence of the h-index,4
2013,2013_34_2,The agenda development process of the United States' National Action Alliance for Suicide Prevention Research Prioritization Task Force.,3
2013,2013_34_3,Research output and impact of a group of emergency physicians selected according to research career criteria,3
2013,2013_34_4,A relational approach to an algebraic community: from paul erd?s to he jifeng,3
2013,2013_34_5,D'Angelo & Francesco Rosati,6
2013,2013_34_6,Papers published from 1995 to 2012 by six Traditional Chinese Medicine universities in China: a bibliometric analysis based on science citation index,2
2013,2013_34_7,Rank variability of the Publish or Perish metrics for economics and finance journals,8
2013,2013_34_8,Driving forces in researchers mobility,6
2013,2013_34_9,Citation analysis of the dry eye literature,3
2013,2013_34_10,???????? g ??????????????????,0
2013,2013_35_1,¡ Y ahí estamos de nuevo!,5
2013,2013_35_2,Culturomics: le numérique et la culture,8
2013,2013_35_3,??????? ??????? ? ????????????? ??????? ??????: ????????? ??????? ? ???? ??????,12
2013,2013_35_4,???????????????????????,12
2013,2013_35_5,?????????????????????,6
2013,2013_35_6,Gestão de Projetos e Sustentabilidade: um estudo bibliométrico da produção científica na base WEB OF SCIENCE,8
2013,2013_35_7,H ???? H ???????????????,7
2013,2013_35_8,???????????????????,5
2013,2013_35_9,Bibliometrie in der Forschungsevaluation. Zur Konstitution und Funktionslogik wechselseitiger Beobachtung zwischen Wissenschaft und Politik1,7
2013,2013_36_1,????????????????,8
2013,2013_36_2,?????????????? H ????,6
2013,2013_36_3,Perfil dos bolsistas de produtividade do Conselho Nacional de Desenvolvimento Científico e Tecnológico (CNPq) na área de Medicina Veterinária,7
2013,2013_36_4,TOPSIS ??????????????????,8
2013,2013_36_5,Informationstechnische Aspekte des Historical Text Re-use,5
2013,2013_36_6,????????? H ????,6
2013,2013_36_7,? ??????????? ??????????,5
2013,2013_36_8,Der Nutzen informetrischer Analysen und nicht-textueller Dokumentattribute für das Information Retrieval in digitalen Bibliotheken,5
2013,2013_36_9,Analýza tematické koncentrace textu: komparace publicistiky Ladislava Jehli?ky a Karla ?apka,4
2013,2013_37_1,????????????????????,0
2013,2013_37_2,?????????????????????? [J],0
2013,2013_37_3,??????? CNKI ? Scopus ?????????????,4
2013,2013_37_4,?????????????????,4
2013,2013_37_5,H-index ? ?? ?? ?? ?? ?? ?? ?? ? ? ??,0
2013,2013_37_6,Évaluation comparative et objective de la production scientifique de services hospitaliers au seine de l'Assistance publique-Hôpitaux de Paris: analyze des scores ...,0
2013,2013_37_7,?? ESI ???????????????????,5
2013,2013_37_8,Diferencas entre as medidas do indice-h geradas em distintas fontes bibliograficas e engenho de busca,0
2013,2013_37_9,Generación de sistemas de recuperación de información para la gestión documental en el área de las Ciencias de la Computación,4
2013,2013_37_10,¿ Se puede evaluar la calidad de las revistas científicas?: principales limitaciones,6
2013,2013_38_1,Gestão da Cadeia de Suprimentos e Sustentabilidade: um estudo bibliométrico da produção científica na base Web of Science,4
2013,2013_38_2,?????? ?????? ??????? ?????????? ??????? ?????????? ?????????????,15
2013,2013_38_3,?? h ??? hm ???? ????? ??????,7
2013,2013_38_4,"Desempenho dos programas de pós-graduação stricto sensu em administração, ciências contábeis e turismo no Brasil: um estudo dos programas no período de  …",0
2013,2013_38_5,Revealing comparative advantages in the backbone of science,2
2013,2013_38_6,Evaluating the growth pattern and relative performance in Nipah virus research from 1999 to 2010,5
2013,2013_38_7,A tool for scientific provenance of data and software,3
2013,2013_38_8,Biomedical publication–A neglected art in medical education in India,2
2013,2013_38_9,Quantity and impact through a single indicator,4
2013,2013_38_10,Network analysis for predicting academic impact,4
2013,2013_39_1,In medio stat virtus: Some thoughts about journal Impact Factor.,2
2013,2013_39_2,How authors can maximise the chance of manuscript acceptance and article visibility,1
2013,2013_39_3,Beyond Publication Counts–The Impact of Citations and Combined Metrics on the Performance Measurement of German Business Researchers,3
2013,2013_39_4,"The global university, the political economy of knowledge in Asia and the segmentation of China's higher education",3
2013,2013_39_5,Burr hole drainage: could be another treatment option for cerebrospinal fluid leakage after unidentified dural tear during spinal surgery?,0
2013,2013_39_6,"Statistical Evaluation of Bibliographical Data: Evaluation of Journals, Scientists, and Institutions",2
2013,2013_39_7,"Structure and dynamics of coauthorship, citation, and impact within cscw",3
2013,2013_39_8,Analyzing citation frequencies of leading software engineering scholars,3
2013,2013_39_9,Accounting journals and the ABS Guide: a review of evidence and inference,3
2013,2013_39_10,Variability of citation behavior between scientific fields and the normalization problem: The “citing-side” normalization in context,2
2013,2013_40_1,Deconstructing centrality: thinking locally and ranking globally in networks,3
2013,2013_40_2,Scientometrics and relevant bibliographic databases in the field of aquaculture.,3
2013,2013_40_3,Why an Unbiased External R&D Evaluation System is Important for the Progress of Social Sciences—the Case of a Small Social Science Community,2
2013,2013_40_4,Bandwagon of impact factor for journal scientometrics,4
2013,2013_40_5,The elephant in the room: multi-authorship and the assessment of individual researchers,7
2013,2013_40_6,"Historical developments in Bayesian econometrics after Cowles Foundation monographs 10, 14",2
2013,2013_40_7,Analysis of various bibliometric indicators for the evaluation of scientific journals and scientists,2
2013,2013_40_8,A pragmatic means for measuring the complexity of source code ensembles,5
2013,2013_40_9,Evaluation and ranking of researchers–Bh Index,5
2013,2013_40_10,Certainty equivalent citation: generalized classes of citation indexes,2
2013,2013_41_1,Scientist rankings: What nurse scientists need to know,3
2013,2013_41_2,Attributes of a surgical chairperson associated with extramural funding of a department of surgery,3
2013,2013_41_3,Subgraph enumeration in dynamic graphs,3
2013,2013_41_4,Citation analysis as a practical tool for managers and entrepreneurs: selected scientometric concepts relevant for business model improvement,2
2013,2013_41_5,Is there a correlation between journal impact factor and researchers' performance? A study comprising the fields of clinical nephrology and neurosciences,2
2013,2013_41_6,Adding value to scholarly journals through a citation indexing system,3
2013,2013_41_7,The impact factor,3
2013,2013_41_8,I Publish in I Edit?-Do Editorial Board Members of Urologic Journals Preferentially Publish Their Own Scientific Work?,4
2013,2013_41_9,Thematic concentration in Japanese prose,3
2013,2013_41_10,Measuring the evaluation and impact of scientific works and their authors,3
2013,2013_42_1, Analysis of Latin American scientific production in medicine,0
2013,2013_42_2, Simple rational extension of Hirsch index,0
2013,2013_42_3,Analysis of the scientific activity of the Spanish public universities in the area of \u200b\u200bcomputer technologies,0
2013,2013_42_4,?????????????,4
2013,2013_42_5,Vorschläge für Standards zur Anwendung der Szentometrie bei der Evaluation von einzelnen Wissenschaftler (inne) n im Bereich der Naturwissenschaften / Proposals ...,0
2013,2013_42_6,????????????? ???????? ????????????? ??????-????????????????? ???????????? ??????????? ? ????????? ?????? ? ??????? ???????? ?  …,0
2013,2013_42_7,"g ??? h ??, e ?????????????",5
2013,2013_42_8,???????????,4
2013,2013_42_9,A PRODUTIVIDADE CIENTÍFICA EM WoS E NO ÍNDICE H DE HIRCHS DA ÁREA DE EDUCAÇÃO FISICA NA ESPANHA E BRASIL: PRODUTIVIDADE E  …,0
2013,2013_42_10,ESI ? h ?? ?? ?? ??,0
2013,2013_43_1,?? h ??? g ?????????????????,3
2013,2013_43_2,Information Retrieval und Informetrie: Zur Anwendung informetrischer Methoden in digitalen Bibliotheken,3
2013,2013_43_3,Gestão de periódicos científicos: um estudo com revistas da área de administração,4
2013,2013_43_4,???? g ??????????????——??????????????,5
2013,2013_43_5,"5 ??????????????????!"""""" ??????????",0
2013,2013_43_6,???????????????????????,3
2013,2013_43_7,????????????——???????????,3
2013,2013_43_8,h ?????????????????,3
2013,2013_43_9,??????? h ????????,2
2013,2013_43_10,Profile and analysis of scientific production of Brazilian researchers in Clinical Neurosciences,1
2013,2013_44_1,??????????????????,2
2013,2013_44_2,??????????????,2
2013,2013_44_3,La producción de la geografía española a través de las bases de datos de Scopus e ISI Web of Knowledge,3
2013,2013_44_4,???????????????????,3
2013,2013_44_5,?? h ????????????,5
2013,2013_44_6,????????????????,2
2013,2013_44_7,???????????,5
2013,2013_44_8,hg ?????????????????????,0
2013,2013_44_9,?? h ????????,3
2013,2013_44_10,Monitoramento e controle de projetos de desenvolvimento de Software com o Scrum: avaliação da Produção Científica,3
2013,2013_45_1,??,0
2013,2013_45_2,?? ?,0
2013,2013_45_3, Água e sustentabilidade: Um levantamento da produção científica and hot topics publicados na última década,0
2013,2013_45_4,??,0
2013,2013_45_5,?? ? ?,0
2013,2013_45_6,Hi ?? - ? ? h ?? \u200b\u200b?? ?? ??,0
2013,2013_45_7,Perfil e análise da produção científica dos pesquisadores brasileiros em Neurociência Clínica,4
2013,2013_45_8,??????????????????,3
2013,2013_45_9,Profile and scientific production of Brazilian National Council of Technological and Scientific Development researchers in Pediatrics,3
2013,2013_45_10,Compétition académique et modes de production scientifique des économistes français,2
2013,2013_46_1,???????????????????? 5 ?????,4
2013,2013_46_2,¿ Favorece la publicación en abierto el impacto de los artículos científicos? Un estudio empírico en el ámbito de la medicina intensiva,5
2013,2013_46_3,Periódicos de Ciência da Informação nas bases de dados internacionais,0
2013,2013_46_4,?? JASIST ???????????,4
2013,2013_46_5,??????????????????????????,0
2013,2013_46_6,The role of national university rankings in an international context: The case of the I-UGR Rankings of Spanish Universities,1
2013,2013_46_7,V-index an index based on consistent researcher productivity,2
2013,2013_46_8,Problems arising in evaluation of interdisciplinary scientific research for innovation,2
2013,2013_46_9,Measuring hot topics in sciences,2
2013,2013_46_10,The generalized Pareto distribution fitted to research outputs of countries,1
2013,2013_47_1,An Empirical Study to Find an Approximate Ranking of Citation Statistics Over Subject Fields,1
2013,2013_47_2,Structural and collaborative properties of team science networks,2
2013,2013_47_3,Temporal study of countries' scientific evolution based on two?dimensional approach,1
2013,2013_47_4,Recommending intra-institutional scientific collaboration through coauthorship network visualization,2
2013,2013_47_5,Prominence in Networks: A Co-evolving process,2
2013,2013_47_6,The intellectual influence of economic journals: quality versus quantity,2
2013,2013_47_7,A Content Analysis of the “International Journal on Marine Navigation and Safety of Sea Transportation” from 2007 to 2012,3
2013,2013_47_8,Are you in h?,2
2013,2013_47_9,The Product and System Specificities of Measuring Curation Impact,1
2013,2013_48_1,Vitiligo: A quantitative analysis of the world research output during 2001-2012,1
2013,2013_48_2,On journal ranking: A conundrum for interior design,2
2013,2013_48_3,A refinement of Egghe's increment studies: an alternative version,1
2013,2013_48_4,New index for quantifying an individual's scientific research output,2
2013,2013_48_5,Modelling some structural indicators in an h-index context: A shifted Zipf and a decreasing exponential model,6
2013,2013_48_6,Attitudes about publishing and normal science advancement,4
2013,2013_48_7,An agent-based model for the bibliometric h-index,4
2013,2013_48_8,Flattening network data for causal discovery: What could go wrong?,2
2013,2013_48_9,Building a global performance indicator to evaluate academic activity using fuzzy measures,2
2013,2013_49_1,Semi-supervised structuring of complex data,1
2013,2013_49_2,Is it possible to evaluate researcher s work using bibliometric indicators?,0
2013,2013_49_3,What Affects Citation Counts in MIS Research Articles? An Empirical Investigation,3
2013,2013_49_4,From Signtometrics to Scientometrics: A Cautionary Tale of Our Times,2
2013,2013_49_5,Citation-based indices of scholarly impact: Databases and norms,1
2013,2013_49_6,Quantifying published scholarly works of experiential education directors,2
2013,2013_49_7,Research productivity and fellowship training in neurosurgery,1
2013,2013_49_8,Social media and citation metrics,1
2013,2013_49_9,Making the H-index more relevant: A step towards standard classes for citation classification,2
2013,2013_49_10,r-index: Quantifying the quality of an individual's scientific research output,1
2013,2013_50_1,Profiles of English language music therapy journals,0
2013,2013_50_2,A Detection of the Most Influential Documents,2
2013,2013_50_3,Beyond Keyword Search: Representations and Models for Personalization,1
2013,2013_50_4,Data cleaning and matching of institutions in bibliographic databases,1
2013,2013_50_5,Embedding librarians into the STEM publication process,1
2013,2013_50_6,Serious Research with Great Fun: the Strange Case of Jan Šuspa Lepš (and Other Plant Ecologists),1
