Year,FileName,Title,Citation Count
2015,2015_3_10,Mapping the scientific research on life cycle assessment: a bibliometric analysis,38
2015,2015_4_1,Scholarly Productivity and National Institutes of Health Funding of Foundation for Anesthesia Education and Research Grant RecipientsInsights from a  …,22
2015,2015_4_2,????????? ???????????? ??????? ?????????? ? ???????????????? ????? ??????,0
2015,2015_4_3,Global methaemoglobinaemia research output (1940–2013): a bibliometric analysis,21
2015,2015_4_4,"A generalized view of self-citation: Direct, co-author, collaborative, and coercive induced self-citation",23
2015,2015_4_5,Global research productivity of N-acetylcysteine use in paracetamol overdose: a bibliometric analysis (1976–2012),17
2015,2015_4_6,Analyzing the scientific evolution of social work using science mapping,28
2015,2015_4_7,Structuring the Technology Entrepreneurship publication landscape: Making sense out of chaos,17
2015,2015_4_8,Economics in Latin America: a bibliometric analysis,28
2015,2015_4_9,"Scientific research related to calcium channel blockers poisoning: Bibliometric analysis in Scopus, 1968–2012",16
2015,2015_4_10,The relationship between the research performance of scientists and their position in co-authorship networks in three fields,28
2015,2015_5_1,Ranking scientists,18
2015,2015_5_2,"Determining the drivers of academic success in surgery: an analysis of 3,850 faculty",16
2015,2015_5_3,A flexible bibliometric approach for the assessment of professorial appointments,17
2015,2015_5_4,"Past, current and future of biomass energy research: A bibliometric analysis",29
2015,2015_5_5,The association of the H-index and academic rank among full-time academic hand surgeons affiliated with fellowship programs,22
2015,2015_5_6,Research productivity in top-ranked schools in psychology and social work: Does having a research culture matter?,23
2015,2015_5_7,Improving chemical entity recognition through h-index based semantic similarity,19
2015,2015_5_8,Understanding bibliometric parameters and analysis,24
2015,2015_5_9,Potentially coercive self-citation by peer reviewers: a cross-sectional study,16
2015,2015_5_10,Do PageRank-based author rankings outperform simple citation counts?,16
2015,2015_6_1,A descriptive and historical review of bibliometrics with applications to medical sciences,18
2015,2015_6_2,Are quantitative measures of academic productivity correlated with academic rank in plastic surgery? A national study,20
2015,2015_6_3,The bibliometric analysis of scholarly production: How great is the impact?,21
2015,2015_6_4,The Altmetric Score: a new measure for article-level dissemination and impact,36
2015,2015_6_5,Talking to the crowd: What do people react to in online discussions?,17
2015,2015_6_6,Assessing the true role of coauthors in the h-index measure of an author scientific impact,14
2015,2015_6_7,Ranking and identifying influential scientists versus mass producers by the Perfectionism Index,11
2015,2015_6_8,Bibliometric analysis of research publications of Maharshi Dayanand University (Rohtak) during 2000-2013,11
2015,2015_6_9,Scientific publications from Arab world in leading journals of Integrative and Complementary Medicine: a bibliometric analysis,17
2015,2015_6_10,The power of repetition: repetitive lyrics in a song increase processing fluency and drive market success,16
2015,2015_7_1,Comparative analysis of some individual bibliometric indices when applied to groups of researchers,16
2015,2015_7_2,Using rank aggregation for expert search in academic digital libraries,10
2015,2015_7_3,Scholarly social media profiles and libraries: A review,18
2015,2015_7_4,Measuring the outcome of biomedical research: a systematic literature review,14
2015,2015_7_5,The pagerank-index: Going beyond citation counts in quantifying scientific impact of researchers,15
2015,2015_7_6,Publication productivity of neurosurgeons in Great Britain and Ireland,11
2015,2015_7_7,A bibliometric study of China's science and technology policies: 1949–2010,17
2015,2015_7_8,Poorly Cited Articles in Peer-Reviewed Cardiovascular Journals from 1997-2007: Analysis of 5-Year Citation Rates,17
2015,2015_7_9,Predicting results of the Research Excellence Framework using departmental h-index,12
2015,2015_7_10,Assessing the profile of top Brazilian computer science researchers,11
2015,2015_8_1,Citing a Data Repository: a case study of the Protein Data Bank,14
2015,2015_8_2,Mathematics without apologies: Portrait of a problematic vocation,0
2015,2015_8_3,Underpinning strategic behaviours and posture of principal investigators in transition/uncertain environments,19
2015,2015_8_4,"Educational Expertise, Advocacy, and Media Influence.",18
2015,2015_8_5,"OM3: Ordered maxitive, minitive, and modular aggregation operators–Axiomatic and probabilistic properties in an arity-monotonic setting",8
2015,2015_8_6,The role of academic collaboration in the impact of Latin-American research on management,12
2015,2015_8_7,REFORE: A recommender system for researchers based on bibliometrics,20
2015,2015_8_8,How do collaborative features affect scientific output? Evidences from wind power field,13
2015,2015_8_9,Comparison of bibliometric measures for assessing relative importance of researchers,9
2015,2015_8_10,"Data Fusion: Theory, Methods, and Applications",10
2015,2015_9_1,The elevation of annals of rehabilitation medicine to the status of an international journal after adopting an English-only policy,7
2015,2015_9_2,Vegas: Visual influence graph summarization on citation networks,18
2015,2015_9_3,A bibliometric analysis of the Turkish software engineering research community,15
2015,2015_9_4,Research trends in electrochemical technology for water and wastewater treatment,13
2015,2015_9_5,The hw-rank: An h-index variant for ranking web pages,9
2015,2015_9_6,Academic productivity and contributions to the literature among spine surgery fellowship faculty,13
2015,2015_9_7,Psychology as a science within Comte's hypothesized hierarchy: Empirical investigations and conceptual implications.,11
2015,2015_9_8,Data-driven journal meta-ranking in business and management,9
2015,2015_9_9,The 100 top-cited tuberculosis research studies,11
2015,2015_9_10,Quality versus quantity in scientific impact,15
2015,2015_10_1,Quality assessment of Wikipedia articles using h-index,12
2015,2015_10_2,The research output of European higher education institutions,12
2015,2015_10_3,Density equalizing mapping of the global tuberculosis research architecture,12
2015,2015_10_4,Do quantitative measures of research productivity correlate with academic rank in oral and maxillofacial surgery?,10
2015,2015_10_5,Do Nobel laureates create prize-winning networks? An analysis of collaborative research in physiology or medicine,14
2015,2015_10_6,Anatomy of funded research in science,16
2015,2015_10_7,Prioritising infectious disease mapping,11
2015,2015_10_8,Five-year institutional bibliometric profiles for 103 US neurosurgical residency programs,12
2015,2015_10_9,The university and the economy: Pathways to growth and economic development,12
2015,2015_10_10,"Myths, Challenges, Risks and Opportunities in Evaluating and Supporting Scientific Research",29
2015,2015_11_1,The patent portfolio value analysis: A new framework to leverage patent information for strategic technology planning,33
2015,2015_11_2,Interfield comparison of academic output by using department level data,7
2015,2015_11_3,Bibliometric indicators of young authors in astrophysics: Can later stars be predicted?,6
2015,2015_11_4,Relationship between category size and journals' impact factor: Implications for emergency medicine journals and researchers,6
2015,2015_11_5,Geographic bias in citation rates of conservation research,13
2015,2015_11_6,A decade of research in statistics: a topic model approach,13
2015,2015_11_7,An evaluation based on highly cited publications in Taiwan,16
2015,2015_11_8,Analysis of quantitative and qualitative indicators of SEE countries scientific output,10
2015,2015_11_9,Current dynamics of scholarly publishing,9
2015,2015_11_10,"Understanding the scientific enterprise: citation analysis, data and modeling",10
2015,2015_12_1,Bibliometric indicators: opportunities and limits,11
2015,2015_12_2,Learning to rank academic experts in the DBLP dataset,9
2015,2015_12_3,Anatomy of scientific evolution,8
2015,2015_12_4,Impact of fellowship training on research productivity in academic ophthalmology,8
2015,2015_12_5,Global ontology research progress: a bibliometric analysis,13
2015,2015_12_6,A simple approach to describe a company's innovative activities and their technological breadth,7
2015,2015_12_7,Use case oriented medical visual information retrieval & system evaluation,5
2015,2015_12_8,From big to little data for natural disaster recovery: how online and on-the-ground activities are connected,8
2015,2015_12_9,Impact analysis of domestic and international research collaborations: a Malaysian case study,8
2015,2015_12_10,Does self-citation influence quantitative measures of research productivity among academic oral and maxillofacial surgeons?,8
2015,2015_13_1,The academic productivity and impact of the University of Toronto Neurosurgery Program as assessed by manuscripts published and their number of citations,11
2015,2015_13_2,Screening for self-plagiarism in a subspecialty-versus-general imaging journal using iThenticate,7
2015,2015_13_3,Multi-criteria group individual research output evaluation based on context-free grammar judgments with assessing attitude,10
2015,2015_13_4,"Altmetrics for information professionals: Past, present and future",16
2015,2015_13_5,Rescaling the h-index,5
2015,2015_13_6,A quantitative examination of the intellectual profile and evolution of information security from 1965 to 2015,8
2015,2015_13_7,Quantitative analysis of the Italian national scientific qualification,7
2015,2015_13_8,Academic benchmarks for otolaryngology leaders,7
2015,2015_13_9,The missing metric: quantifying contributions of reviewers,11
2015,2015_13_10,Gender and the h index in psychology,16
2015,2015_14_1,Leadership in learning and teaching in higher education: Perspectives of academics in non-formal leadership roles,14
2015,2015_14_2,Characterizing highly cited papers in Social Work through H-Classics,10
2015,2015_14_3,A general conceptual framework for characterizing the ego in a network,8
2015,2015_14_4,Completing h,9
2015,2015_14_5,Author ranking based on personalized PageRank,7
2015,2015_14_6,Formation of scientific fields as a universal topological transition,5
2015,2015_14_7,Social Computing for Impact Assessment of Social Change Projects,7
2015,2015_14_8,Unraveling scientific impact: Citation types in marketing journals,13
2015,2015_14_9,Digital repository of associations between environmental variables: a new resource to facilitate knowledge synthesis,9
2015,2015_14_10,Bibliometric analysis on global Catha edulis (khat) research production during the period of 1952–2014,12
2015,2015_15_1,Using heterogeneous patent network features to rank and discover influential inventors,7
2015,2015_15_2,???????????? ??????? ??rints ?? ?????? ????????????-?????????????? ????????? ???????? ?????????? ? ?????? ???????????? ????,20
2015,2015_15_3,Welchen Einfluss haben Wissenschaftler in Medien und auf die Wirtschaftspolitik?,16
2015,2015_15_4,In their own words: using text analysis to identify musicologists' attitudes towards technology,8
2015,2015_15_5,"Knowledge network centrality, formal rank and research performance: evidence for curvilinear and interaction effects",11
2015,2015_15_6,A comparison of plaintiff and defense expert witness qualifications in malpractice litigation in anesthesiology,4
2015,2015_15_7,Analysing the conceptual evolution of qualitative marketing research through science mapping analysis,7
2015,2015_15_8,“How can We Signal the Value of Our Knowledge?” Knowledge-based Reputation and its Impact on Firm Performance in Science-based Industries,7
2015,2015_15_9,Scholarly investigation into otitis media: who is receiving funding support from the National Institutes of Health?,9
2015,2015_15_10,Conferences versus journals in computer science,12
2015,2015_16_1,Impact-oriented science policies and scientific publication practices: The case of life sciences in Japan,7
2015,2015_16_2,Restricting the h-index to a publication and citation time window: A case study of a timed Hirsch index,8
2015,2015_16_3,Motivation and research productivity in a university system undergoing transition,6
2015,2015_16_4,The evolution of peer review as a basis for scientific publication: directional selection towards a robust discipline?,10
2015,2015_16_5,Does Quantity Make a Difference?,7
2015,2015_16_6,Multiple h-index: a new scientometric indicator,5
2015,2015_16_7,From research to practice: Which research strategy contributes more to clinical excellence? Comparing high-volume versus high-quality biomedical research,6
2015,2015_16_8,Gender differences in scholarly productivity within academic gynecologic oncology departments,8
2015,2015_16_9,Genetic algorithms and Gaussian Bayesian networks to uncover the predictive core set of bibliometric indices,5
2015,2015_16_10,Congenital toxoplasmosis: an in-depth density-equalizing mapping analysis to explore its global research architecture,8
2015,2015_17_1,The role of chairman and research director in influencing scholarly productivity and research funding in academic orthopaedic surgery,9
2015,2015_17_2,Using reference groups to assess academic productivity in computer science,6
2015,2015_17_3,A bibliometric analysis of scholarly work in leading tourism and hospitality journals: the case of Turkey,7
2015,2015_17_4,Collaboration signatures reveal scientific impact,6
2015,2015_17_5,Introducing sub-impact factor (SIF-) sequences and an aggregated SIF-indicator for journal ranking,6
2015,2015_17_6,Citation impact scores of top African American scholars in social work schools: The story behind the data,11
2015,2015_17_7,Systematic methodology for excavating sleeping beauty publications and their princes from medical and biological engineering studies,6
2015,2015_17_8,Scientific research of senior Italian academics of occupational medicine: a citation analysis of products published during the decade 2001–2010,4
2015,2015_17_9,Making science: New generations of collaborative knowledge production,8
2015,2015_17_10,Open Science in der Soziologie: Eine interdisziplinäre Bestandsaufnahme zur offenen Wissenschaft und eine Untersuchung ihrer Verbreitung in der  …,0
2015,2015_18_1,?????????? «???????»?(??????????? ? ???????????),15
2015,2015_18_2,Publish or teach? The role of the scientific environment on academics' multitasking,4
2015,2015_18_3,A bibliometric analysis of innovation research,5
2015,2015_18_4,Ranking Romanian academic departments in three fields of study using the g-index,5
2015,2015_18_5,A 5-year scientometric analysis of research centers affiliated to Tehran University of Medical Sciences,2
2015,2015_18_6,Ebola and Its Global Research Architecture—Need for an Improvement,10
2015,2015_18_7,Does massive funding support of researchers work?: Evaluating the impact of the South African research chair funding initiative,6
2015,2015_18_8,The research impact of school psychology faculty,3
2015,2015_18_9,Tc-index: A new research productivity index based on evolving communities,3
2015,2015_18_10,CITEX: A new citation index to measure the relative importance of authors and papers in scientific publications,6
2015,2015_19_1,The answer is not 42,2
2015,2015_19_2,Open Innovation research: trends and influences–a bibliometric analysis,4
2015,2015_19_3,Geo-social ranking: functions and query processing,7
2015,2015_19_4,"Transforming science in South Africa: Development, collaboration and productivity",10
2015,2015_19_5,"How different are higher education institutions in the UK, US and Australia? The significance of government involvement",6
2015,2015_19_6,SCIENTOMETRIC ANALYSIS OF IEEE TRANSACTIONS ON POWER ELECTRONICS,4
2015,2015_19_7,Some variations on the standard theoretical models for the h?index: A comparative analysis,6
2015,2015_19_8,Mapping of Tuberculosis (TB) research in India during 2004-2013: a bibliometric analysis,4
2015,2015_19_9,Ranking cricket teams,5
2015,2015_19_10,Influential analysis in micro scholar social networks,4
2015,2015_20_1,Contribution and Trend to Quality Research-a literature review of SERVQUAL model from 1998 to 2013,8
2015,2015_20_2,What drives the relevance and reputation of economics journals? An update from a survey among economists,6
2015,2015_20_3,Estimates of Arab world research productivity associated with desalination: a bibliometric analysis,5
2015,2015_20_4,"Academic impact rankings of neurosurgical units in the UK and Ireland, as assessed with the h-index",4
2015,2015_20_5,Chinese universities economic research output 2000–2010,3
2015,2015_20_6,An updated h-index measures both the primary and total scientific output of a researcher,5
2015,2015_20_7,Measuring the attractiveness of academic journals: A direct influence aggregation model,3
2015,2015_20_8,Scientometric mapping of research on 'Big Data',11
2015,2015_20_9,Measuring the quantity and quality of scholarly productivity in criminology and criminal justice: a test of three integrated models,6
2015,2015_21_1,The h-index in Academic Morphology,4
2015,2015_21_2,Peer-Selected “Best Papers”—Are They Really That “Good”?,4
2015,2015_21_3,Understanding the selection processes of public research projects in agriculture: The role of scientific merit,6
2015,2015_21_4,Considering context in academic medicine: Differences in demographic and professional characteristics and in research productivity and advancement metrics across  …,6
2015,2015_21_5,Prediction of junior faculty success in biomedical research: Comparison of metrics and effects of mentoring programs,4
2015,2015_21_6,An overview of animal science research 1945–2011 through science mapping analysis,8
2015,2015_21_7,Problems and challenges of information resources producers' clustering,3
2015,2015_21_8,Highest Impact Articles in Microsurgery: A Citation Analysis,3
2015,2015_21_9,A strategic management approach for Korean public research institutes based on bibliometric investigation,3
2015,2015_21_10,Defining the role of cognitive distance in the peer review process with an explorative study of a grant scheme in infection biology,11
2015,2015_22_1,Core indicators and professional recognition of scientometricians,0
2015,2015_22_2,Vertrackte Karrieren: Zum Wandel der Arbeitswelten in Wirtschaft und Wissenschaft,9
2015,2015_22_3,"Scientometrics: Review of concepts, applications, and indicators",0
2015,2015_22_4,Clasificación de investigadores colombianos (Webometrics versión beta): los que faltaron,0
2015,2015_22_5,Diseminación y divulgación científica,20
2015,2015_22_6,Devenir professeur des universités,8
2015,2015_22_7,International visibility of mainland China Translation Studies community: A scientometric study,4
2015,2015_22_8,Evolution of a Ranking Algorithm for Scientific Documents in the Computer Science Area,2
2015,2015_22_9,OSL Platform: A Link to Open-access Scientific Information and Structured Data,2
2015,2015_22_10,A Novel Ranking Model for a Large-Scale Scientific Publication,3
2015,2015_23_1,Multinational teams and diseconomies of scale in collaborative research,6
2015,2015_23_2,What Does It Take To Be A Successful Pediatric Surgeon–Scientist?,3
2015,2015_23_3,"A new editorial team, and a new indicator of where RP stands",3
2015,2015_23_4,Evaluating impact in the ROS ecosystem,3
2015,2015_23_5,Citation indexes of scientific works,4
2015,2015_23_6,Unsupervised characterization of research institutions with task-force estimation,3
2015,2015_23_7,Cooperation and coauthorship in scientific publishing,6
2015,2015_23_8,"Using citation indexes, citation searching, and bibliometrics to improve chemistry scholarship, research, and administration",5
2015,2015_23_9,Will This Paper Increase Your h-index?,6
2015,2015_24_1,Voicing an impact: who does the National Institutes of Health support for voice disorder research?,4
2015,2015_24_2,Ranking search results in library information systems—considering ranking approaches adapted from web search engines,8
2015,2015_24_3,Object-based relationship search using a plurality of sub-queries,5
2015,2015_24_4,Bibliometric indices for the assessment of the citation curve tail,2
2015,2015_24_5,A Bibliometric Study on Growth of Research in an Indian Medical College,1
2015,2015_24_6,Average evaluation intensity: A quality-oriented indicator for the evaluation of research performance,4
2015,2015_24_7,Unravelling the performance of individual scholars: Use of Canonical Biplot analysis to explore the performance of scientists by academic rank and scientific field,6
2015,2015_24_8,Quantitative and qualitative STS: The intellectual and practical contributions of scientometrics,3
2015,2015_24_9,"The most?cited articles in dental, oral, and maxillofacial traumatology during 64 years",6
2015,2015_24_10,Co-authorship credit allocation methods in the assessment of citation impact of chemistry faculty,2
2015,2015_25_1,"Spine fellowships, ESPN rankings, and the AP Top 25",2
2015,2015_25_2,Leading universities in Latin America in business and management research,4
2015,2015_25_3,Do first rate scientists work at first rate organizations?,3
2015,2015_25_4,Conceptual Impact-Based Recommender System for CiteSeerx.,2
2015,2015_25_5,Assessing and developing early careers in academic research: how can we improve the current systems?,2
2015,2015_25_6,Advances in Knowledge Discovery and Data Mining,5444
2015,2015_25_7,Data mining citation databases: A new index measure that predicts nobel prizewinners,2
2015,2015_25_8,A local PageRank algorithm for evaluating the importance of scientific articles,4
2015,2015_25_9,Ranking scientific journals via latent class models for polytomous item response data,3
2015,2015_25_10,How to conduct a multi-item research assessment in bibliometric studies? Theoretical support and empirical evidence,3
2015,2015_26_1,Classifying faulty modules with an extension of the H-index,4
2015,2015_26_2,An increasing citation black hole in ecology and evolution,3
2015,2015_26_3,"Ranking Iranian biomedical research centers according to H-variants (G, M, A, R) in Scopus and Web of Science",5
2015,2015_26_4,On the Impact of Academic Factors on Scholar Popularity: A Cross-Area Study,2
2015,2015_26_5,OR Forum—Tenure analytics: Models for predicting research impact,4
2015,2015_26_6,S-index: towards better metrics for quantifying research impact,3
2015,2015_26_7,Analytic hierarchy process and supply chain management: A bibliometric study,8
2015,2015_26_8,"Which physician assessment index: H, G or R?",0
2015,2015_26_9,"Personal Learning with Social Media: Reputation, Privacy and Identity Perspectives",947
2015,2015_27_1,The distribution of the asymptotic number of citations to sets of publications by a researcher or from an academic department are consistent with a discrete  …,9
2015,2015_27_2,??????: ??????????????,0
2015,2015_27_3,"Indicadores bibliométricos de la Revista CONAMED, 2008-2012",0
2015,2015_27_4,??????????? ???????? ???????????? ?????????? ?????? ?? ?????? ????,0
2015,2015_27_5,??????????? ????????? ???????? ?????????? ? ????????-????????,8
2015,2015_27_6,????????????????,7
2015,2015_27_7,Análisis de las revistas iberoamericanas de Psicología y de Educación indexadas en el Journal Citation Reports del 2013,16
2015,2015_27_8,La evaluación del factor de impacto individual de investigadores y centros de investigación utilizando el algoritmo RC,0
2015,2015_27_9,Bibliometrijski pokazatelji za procjenu kvalitete znanstvenih ?asopisa,0
2015,2015_27_10,?? 1998—2013 ? SCIE ??????????,0
2015,2015_28_1, The Influence of the Coautorship Network on the Level of Productivity Grants in the Production Engineering Area,0
2015,2015_28_2, souvenir craft and the promotion of the image of the tourist place,0
2015,2015_28_3,"H Index and scientific output of researchers in medicine from the University of Guadalajara, Mexico",0
2015,2015_28_4, Leiden Manifesto on Search Metrics,0
2015,2015_28_5, Challenges of publishing scientific journals in Brazil,0
2015,2015_28_6, ???????? ????????????? ??????? ??????????? ??? ??????? ???????????? ??????? ?????? ??????????? ??????? ????????????,0
2015,2015_28_7,The research activity of the current faculty of the Greek chemical engineering departments: a bibliometric study in national and international context,4
2015,2015_28_8,"Measuring of"" Idea-Based"" Influence of Scientific Papers",6
2015,2015_28_9,“Platinum H”: Refining the H-Index to More Realistically Assess Career Trajectory and Scientific Publications,2
2015,2015_28_10,Co-authorship and the measurement of individual productivity,3
2015,2015_29_1,"Review: Public service motivation—practical problems, scientific evidence and the role of a research community",3
2015,2015_29_2,"A Scientometric Approach to Determine and Analyze Productivity, Impact and Topics Based upon Personal Publication Lists.",3
2015,2015_29_3,Policy Incentives and Research Productivity in the Romanian Higher Education. An Institutional Approach,1
2015,2015_29_4,Random walks on the reputation graph,5
2015,2015_29_5,Procedures vs. Incentives: The Case of the University Promotion System in Italy,2
2015,2015_29_6,Evaluating the merit of research in clinical cardiology: from citation to declaration,1
2015,2015_29_7,Author credit for transdisciplinary collaboration,4
