Year,FileName,Title,Citation Count
2005,2005_1_1,A Hirsch-type index for journals,297
2005,2005_1_2,Facts from text—is text mining ready to deliver?,169
2005,2005_1_3,A parameter to quantify dynamics of a researcher's scientific activity,39
2005,2005_1_4,H-index for Price medalists,35
2005,2005_1_5,Measures and mismeasures of scientific quality,22
2005,2005_1_6,Ten challenges to transform taxonomy,21
2005,2005_1_7,Hirsch Index is a creative and appealing construct but be cautious when using it to evaluate individual scholars,16
2005,2005_1_8,An index to quantify an individual's scientific research valid across disciplines,9
2005,2005_1_9,Modified index to quantify individual's scientific research output,0
2005,2005_1_10,Robert Van de Walle,0
2005,2005_2_1,"Big is (made) Beautiful Some comments about the Shanghai ranking of world-class universities Michel Zitt1/2, Ghislaine Filliatreau1",0
2005,2005_2_2,CONFERENCE CALLS,0
2005,2005_2_3,Diez retos para transformar la Taxonomía,0
2005,2005_2_4,"Temporal, categorical, and bibliographic context of scientific texts: interactions and applications",0
2005,2005_2_5,"Recensione a: Le biblioteche dell'Amministrazione centrale in Italia. Roma: AIB Lazio, SSAB, 2004",0
2005,2005_2_6,Les guies temàtiques de Psicologia de les universitats catalanes,0
2006,2006_1_1,Complex networks: Structure and dynamics,7944
2006,2006_1_2,Theory and practise of the g-index,1590
2006,2006_1_3,Comparison of the Hirsch-index with standard bibliometric indicators and with peer judgment for 147 chemistry research groups,642
2006,2006_1_4,A Hirsch-type index for journals,618
2006,2006_1_5,Is it possible to compare researchers with different scientific interests?,532
2006,2006_1_6,Journal status,451
2006,2006_1_7,An improvement of the h-index: The g-index,383
2006,2006_1_8,Using the h?index to rank influential information scientistss,350
2006,2006_1_9,The h index and career assessment by numbers,330
2006,2006_1_10,An informetric model for the Hirsch-index,324
2006,2006_2_1,On the h-index-A mathematical approach to a new measure of publication activity and citation impact,309
2006,2006_2_2,Measures for measures,280
2006,2006_2_3,On the opportunities and limitations of the H-index,232
2006,2006_2_4,An extension of the Hirsch index: Indexing scientific topics and compounds,231
2006,2006_2_5,A new Hirsch-type index saves time and works equally well as the original h-index,218
2006,2006_2_6,New developments related to the Hirsch index,188
2006,2006_2_7,Exploring the h-index at the author and journal levels using bibliometric data of productive consumer scholars and business-related journals respectively,162
2006,2006_2_8,Gender differences in publication output: towards an unbiased metric of research performance,163
2006,2006_2_9,"A new era in citation and bibliometric analyses: Web of Science, Scopus, and Google Scholar",142
2006,2006_2_10,h-index sequence and h-index matrix: Constructions and applications,116
2006,2006_3_1,Hirsch-type indices for ranking institutions scientific research output,117
2006,2006_3_2,Data-Centric Systems and Applications,978
2006,2006_3_3,Are network motifs the spandrels of cellular complexity?,85
2006,2006_3_4,Concentration of the most-cited papers in the scientific literature: analysis of journal ecosystems,76
2006,2006_3_5,"Gender Differences in Publication Output: Towards an
Unbiased Metric of Research Performance",166
2006,2006_3_6,Simple models and the corresponding h-and g-index,49
2006,2006_3_7,Articles with authors affiliated to Brazilian institutions published from 1994 to 2003 with 100 or more citations: I-the weight of international collaboration and the …,17
2006,2006_3_8,Superiority of the $ h $-index over the Impact Factor for Physics,40
2006,2006_3_9,"Open, fair, and free journal ranking for researchers",32
2006,2006_3_10,Towards a better list of citation superstars: compiling a multidisciplinary list of highly cited researchers,28
2006,2006_4_1,Use of bibliometric information to assist research policy making. A comparison of publication and citation profiles of Full and Associate Professors at a School of  …,26
2006,2006_4_2,Through a glass darkly,23
2006,2006_4_3,H ??? G ??——?????????????,77
2006,2006_4_4,The delicate topic of the impact factor,19
2006,2006_4_5,Articles with authors affiliated to Brazilian institutions published from 1994 to 2003 with 100 or more citations: II-identification of thematic nuclei of excellence in …,17
2006,2006_4_6,"The impact of tourism knowledge: Google scholar, citations and the opening up of academic space",17
2006,2006_4_7,"First CytoJournal Peer-Reviewer's Retreat in 2006–Open access, peer-review, and impact factor",15
2006,2006_4_8,Refining the h-index,13
2006,2006_4_9,El índice h de Hirsch: aportaciones a un debate,48
2006,2006_4_10,Bibliometrics as a research assessment tool: impact beyond the impact factor,42
2006,2006_5_1,Introducing the h-index in telescope statistics,10
2006,2006_5_2,Vitaly L. Ginzburg—A bibliometric study,0
2006,2006_5_3,Impacto de Autor CUIDEN Citación: Trayectorias científicas relevantes y excelencia a través del Factor h (h-index) de Hirsch en el espacio científico  …,0
2006,2006_5_4,???? ??? ?? h-??? ??? ?? ??,0
2006,2006_5_5,Georg (e) Placzek: a bibliometric study of his scientific production and its impact,5
2006,2006_5_6,Anwendungsorientierte Grundlagenforschung in der Psychologie,13
2006,2006_5_7,El factor h de Hirsch: the h-index: Una actualización sobre los métodos de evaluación de los autores y sus aportaciones en publicaciones científicas,14
2006,2006_5_8,Einige Anmerkungen zum Impact Factor,9
2006,2006_5_9,Web application to profiling scientific institutions through citation mining,4
2006,2006_6_1,Pensamiento crítico y escéptico en la bibliotecología,4
2006,2006_6_2,On the Dynamics of the $ h-$ index in Complex Networks with Coexisting Communities,3
2006,2006_6_3,"Power-law distribution of individual Hirsch indices, the comparison of merits in different fields, and the relation to a Pareto distribution",3
2006,2006_6_4,Introduction to the special section: Professional issues in psychological science and a discussion of collaboration indicators,4
2006,2006_6_5,?????????????????????,5
2006,2006_6_6,Scientific production on tetrachloro-dibenzo-dioxins: A bibliometric study,2
2006,2006_6_7,A Statistic Study for the ADBIS Period 1994-2006.,3
2006,2006_6_8,"Over centrum en periferie in de sociaal-geografische wetenschappen, met bijzondere aandacht voor de positie van de Vlaamse en Nederlandse geografen",2
2006,2006_6_9,"Science Citation Index"": Un estudio de caso",4
2006,2006_6_10,Some improvements on h-index: Measuring research outputs by citations,2
2006,2006_7_1,Using time dependent citation rates (sales curves) for comparing scientific impacts,2
2006,2006_7_2,EVALUATION OF ARTICLES PUBLISHED IN MENDELEY AND CROSSREF IN RELATION TO THE GOOGLE SCHOLAR PAGES,0
2006,2006_7_3,Physics in Cuba: impact from Scientific publications,0
2006,2006_7_4,The Value of Einstein's Mistakes,0
2006,2006_7_5,INSTRUCTIONS ON THE ANNOTATION OF PDF FILES,621
2006,2006_7_6,High Impact but Less Popular,0
2006,2006_7_7,Autor Impact CUIDEN Citation. Relevant scientific trajectories and excellence in the Iberoamerican scientific space to travs Hirsch's h index,0
2006,2006_7_8,Secure H-numbers,0
2006,2006_7_9,The Hirsch's h-index. An update on the author's evaluation methods and their contributions in scientific publications,0
2006,2006_8_1,Dissemination Level,134
2006,2006_8_2,"Impakt faktor–Dobrý sluha, ale špatný pán",0
2006,2006_8_3,??????? ??? ?????? ??? ?? ??,0
2006,2006_8_4,Stand up for your copyright: la prospettiva dell'autore,0
2006,2006_8_5,"Perversiones, paradojas y traumas en la evaluación cientí?ca",0
2006,2006_8_6,El índice h de Hirsh: aportaciones a un debate,0
2006,2006_8_7,??????????????? Scopus: ?????????,0
2006,2006_8_8,??????? ?????????-??????????????? ???????? ?? ??????????? ??????? ??????????? ?????????? ?????,0
2006,2006_8_9,Evolución del impacto del Boletín de la Sociedad Española de Cerámica y Vidrio,0
2006,2006_9_1,Análisis de la contribución científica,0
2007,2007_1_1,Impact of data sources on citation counts and rankings of LIS faculty: Web of Science versus Scopus and Google Scholar,770
2007,2007_1_2,Does the h index have predictive power?,670
2007,2007_1_3,"Which h-index?—A comparison of WoS, Scopus and Google Scholar",594
2007,2007_1_4,The R-and AR-indices: Complementing the h-index,564
2007,2007_1_5,What do we know about the h index?,429
2007,2007_1_6,Generalized Hirsch h-index for disclosing latent facts in citation networks,435
2007,2007_1_7,"The h-index: Advantages, limitations and its relation with other bibliometric indicators at the micro level",338
2007,2007_1_8,The rise and rise of citation analysis,295
2007,2007_1_9,Lifting the crown—citation z-score,218
2007,2007_1_10,Co-ranking authors and documents in a heterogeneous network,211
2007,2007_2_1,Scaling the h-index for different scientific ISI fields,200
2007,2007_2_2,The mismeasurement of science,200
2007,2007_2_3,A systematic analysis of Hirsch-type indices for journals,187
2007,2007_2_4,Self-citation corrections for the Hirsch index,164
2007,2007_2_5,Successive h-indices,146
2007,2007_2_6,Achievement index climbs the ranks,141
2007,2007_2_7,Using the h?index to rank influential British researchers in information science and librarianship,142
2007,2007_2_8,Hirsch-index for countries based on Essential Science Indicators data,146
2007,2007_2_9,Eminence of scientists in the light of the h-index and other scientometric indicators,130
2007,2007_2_10,Dynamic h?index: The Hirsch index in function of time,124
2007,2007_3_1,The R- and AR-indices: Complementing the h-index,568
2007,2007_3_2,The influence of missing publications on the Hirsch index,95
2007,2007_3_3,Usefulness of Hirsch'sh-index to evaluate scientific research in Spain,97
2007,2007_3_4,"On the h-index, the size of the Hirsch core and Jin's A-index",93
2007,2007_3_5,Hirsch index or Hirsch rate? Some thoughts arising from Liang's data,84
2007,2007_3_6,National scientific facilities and their science impact on nonbiomedical research,79
2007,2007_3_7,A case study of the Hirsch index for 26 non?prominent physicists,74
2007,2007_3_8,What is the future of peer review? Why is there fraud in science? Is plagiarism out of control? Why do scientists do bad things? Is it all a case of:“All that is  …,67
2007,2007_3_9,Convergent validation of peer review decisions using the h index: extent of and reasons for type I and type II errors,55
2007,2007_3_10,Clustering of scientific fields by integrating text mining and bibliometrics,57
2007,2007_4_1,Who is the” Platz-Hirsch “of the German Economics Profession?,51
2007,2007_4_2,The (bio) diversity of science reflects the interests of society,55
2007,2007_4_3,The pure h-index: calculating an author'sh-index by taking co-authors into account,52
2007,2007_4_4,Measuring conference quality by mining program committee characteristics,50
2007,2007_4_5,Toward alternative measures for ranking venues: a case of database research community,49
2007,2007_4_6,"Impact factor, H index, peer comparisons, and Retrovirology: is it time to individualize citation metrics?",44
2007,2007_4_7,The political science 400: A 20-year update,38
2007,2007_4_8,How do ecological journals stack-up? Ranking of scientific quality according to the h index,40
2007,2007_4_9,The strike rate index: a new index for journal quality based on journal size and the h-index of citations,37
2007,2007_4_10,A rational indicator of scientific creativity,40
2007,2007_5_1,Whither Latin America? trends and challenges of science in Latin America,38
2007,2007_5_2,Soil science and the h index,34
2007,2007_5_3,Playing the citations game,32
2007,2007_5_4,MESUR: usage-based metrics of scholarly impact,34
2007,2007_5_5,El factor de impacto de las revistas científicas: limitaciones e indicadores alternativos,175
2007,2007_5_6,An exploratory study of information systems researcher impact,35
2007,2007_5_7,The feasibility of developing and implementing journal usage factors: a research project sponsored by UKSG.,31
2007,2007_5_8,"R ??, AR ??: h ???????????",110
2007,2007_5_9,Assessing the quality of a scientific journal: the case of Revista Brasileira de Psiquiatria,29
2007,2007_5_10,A bibliometric evaluation of publications in urological journals among European Union countries between 2000–2005,31
2007,2007_6_1,Scoring research output using statistical quantile plotting,27
2007,2007_6_2,Quantifying the impact of hydrological studies,25
2007,2007_6_3,The relevance and recognition of Latin American science. Introduction to the fourth issue of CBP-Latin America,26
2007,2007_6_4,Gatekeepers of science—Effects of external reviewers' attributes on the assessments of fellowship applications,26
2007,2007_6_5,What does Hirsch index evolution explain us? A case study: Turkish Journal of Chemistry,21
2007,2007_6_6,h ???? h ??????????????,90
2007,2007_6_7,Academic institutions in the United States and Canada ranked according to research productivity in the field of conservation biology,19
2007,2007_6_8,Elite scientists and the global brain drain,22
2007,2007_6_9,Impact factors and prestige,17
2007,2007_6_10,Item-time-dependent Lotkaian informetrics and applications to the calculation of the time-dependent h-index and g-index,17
2007,2007_7_1,The science of research: The principles underlying the discovery of cognitive and other biological mechanisms,17
2007,2007_7_2,La productividad científica y el índice h de Hirchs de la psicología social española: convergencia entre indicadores de productividad y comparación con otras  …,0
2007,2007_7_3,Open sourcing ecological data,18
2007,2007_7_4,"Use Google Scholar, Scopus and Web of Science for comprehensive citation tracking",15
2007,2007_7_5,Using publication statistics for evaluation in academic psychiatry,15
2007,2007_7_6,TOP?curves,15
2007,2007_7_7,Colaboración científica entre países de la región latinoamericana,53
2007,2007_7_8,An ontological approach for the quality assessment of computer science conferences,14
2007,2007_7_9,Tracing the influence of JD Bernal on the world of science through citation analysis,14
2007,2007_7_10,CiteSearch: next-generation citation analysis,12
2007,2007_8_1,Delineating the citation impact of scientific discoveries,14
2007,2007_8_2,Una visión crítica del índice h: algunas consideraciones derivadas de su aplicación práctica.,37
2007,2007_8_3,?? h ????????????????,37
2007,2007_8_4,?? SCI ???????????????,39
2007,2007_8_5,????? h-?????????,35
2007,2007_8_6,? h ?????????????????,32
2007,2007_8_7,Measuring research performance in the mathematical sciences in Australian universities,12
2007,2007_8_8,Selecting scientific papers for publication via citation auctions,10
2007,2007_8_9,Software issues related to cited references,10
2007,2007_8_10,"A shifting mosaic of scholarly publishing, scientific delivery, and future impact changing the face of learned societies",9
2007,2007_9_1,El índice h de Hirsch: su aplicación a algunos de los científicos españoles más destacados,29
2007,2007_9_2,Working memory as a construct in cognitive science: An illustrious past and a highly promising future,11
2007,2007_9_3,Distributions of the h-index and the g-index,10
2007,2007_9_4,Diseño de un sistema de información y evaluación científica. Análisis ciencimétrico de la actividad investigadora de la Universidad de Navarra en el área de  …,0
2007,2007_9_5,?????? h ???????——??????????????,28
2007,2007_9_6,h ?????????????????,23
2007,2007_9_7,Asymptotics for the Hirsch index,8
2007,2007_9_8,????? ??????? ? ????????? ?????????????? ????????,20
2007,2007_9_9,Focus and future of occupational health journals,5
2007,2007_9_10,Some bibliometric indexes for members of the Scientific Association of Animal Production (ASPA),6
2007,2007_10_1,???????????????????,18
2007,2007_10_2,Two new discipline-independent indices to quantify individual's scientific research output,7
2007,2007_10_3,Social metadata for the impact factor,7
2007,2007_10_4,Should research performance be measured unidimensionally? Evidence from rankings of academic economists,6
2007,2007_10_5,"Hirsch's index: a case study conducted at the Faculdade de Filosofia, Ciências e Letras de Ribeirão Preto, Universidade de São Paulo",7
2007,2007_10_6,Discovering mentorship information from author collaboration networks,6
2007,2007_10_7,??????????????——h ??????,14
2007,2007_10_8,Producción científica de Cuba: una perspectiva desde la obra de dos mujeres académicas,11
2007,2007_10_9,A scientometric method to analyze scientific journals as exemplified by the area of information science,5
2007,2007_10_10,Profiling topics on the Web for knowledge discovery,6
2007,2007_11_1,Using the h-index to Explore the Scientific Impact of the VLT,6
2007,2007_11_2,Generalized h-index for revealing latent facts in social networks of citations,5
2007,2007_11_3,Impact factor and/or Hirsch index?,12
2007,2007_11_4,Centres of research excellence in economics in the republic of Ireland,4
2007,2007_11_5,Increasing discrepancy between absolute and effective indexes of research output in a Brazilian academic department,5
2007,2007_11_6,"GEOGRAPHICAL KNOWLEDGE, CASE STUDIES AND THE DIVISION OF LABOOUR",5
2007,2007_11_7,Citation auctions as a method to improve selection of scientific papers,3
2007,2007_11_8,What's Hot in Psychology?,2
2007,2007_11_9,Scientific indicators of productivity: Time for action,3
2007,2007_11_10,Time for a rethink of research proposal evaluation?,3
2007,2007_12_1,Hungary-and Tibor Braun-on top,3
2007,2007_12_2,?????????????????????,7
2007,2007_12_3,L'indice h: une nouvelle mesure pour quantifier l'impact scientifique des chercheurs,6
2007,2007_12_4,??????????????,6
2007,2007_12_5,Indice h (2000-2004) de los científicos ambientales más citados que residen en Chile,0
2007,2007_12_6,Top Ten. Diez años de investigación española en Biblioteconomía y Documentación (1996-2006). Ranking e índice h de los 10 autores en activo más citados,5
2007,2007_12_7,Web of Knowledge ???????????????,6
2007,2007_12_8,?????????,4
2007,2007_12_9,Relevantnost i kako se istraživala,4
2007,2007_12_10,"?? H ??, ?? H ??, ????????????",0
2007,2007_13_1,???????????? ????????: ???????? ??????? ????? ??? ??????? JASIS,4
2007,2007_13_2,??????? ?????? ? ??????????????? h-? g-???????,4
2007,2007_13_3,Publication Portfolio of the Czech Economists and Problems of Rankings,2
2007,2007_13_4,The problematic ratings game in modern science,2
2007,2007_13_5,Multidimensional fuzzy integrals,2
2007,2007_13_6,Economics in Ireland,2
2007,2007_13_7,Bibliometrie zwischen Forschung und Dienstleistung,3
2007,2007_13_8,?????????????,0
2007,2007_13_9,El índice h de Hirsch: su aplicación a algunos de los científicos españoles más destacados,29
2007,2007_13_10,????????????????: ?? 12 ????????,0
2007,2007_14_1,????????????,0
2007,2007_14_2,????????? SCIE ????????,0
2007,2007_14_3,"Citace: dobrý sluha, špatný pán",0
2007,2007_14_4,Characterization of researchers in condensed matter physics using simple quantity based on h-index,1
2007,2007_14_5,What impact? Whose value? Citation metrics in a work-flow perspective.,1
2007,2007_14_6,Soil bibliometrics: the h index,1
2007,2007_14_7,Chinese Journal of Chemistry's Hirsch Index: A Case Study of 1995-2005.,1
2007,2007_15_1,Iniciativas institucionales e individuales en la creación de estructuras científicas: El Instituto de Tecnología Química,4
2007,2007_15_2,Índice h de la Revista Chilena de Historia Natural: quinquenio 2000-2004,0
2007,2007_15_3,????: ??????,0
2007,2007_15_4,"Published in: Proceedings of ISSI 2007 (D. Torres-Salinas & HF Moed, eds.). Madrid: CINDOC-CSIC, pp. 514-522",0
2007,2007_15_5,Soil science is in great shape,941
2007,2007_15_6,DEVELOPMENT OF GENERAL-PURPOSE AND SPECIALIZED WEB SEARCH ENGINE,0
2007,2007_16_1,in conversation with rU researchers: What makes a good scientist?,0
2007,2007_16_2,A Higher Degree of Difficulty,0
2007,2007_16_3,Intimology and the search for cognitive mechanisms.,0
2007,2007_16_4,How do ecological journals stack-up? Ranking of scientific quality according to the h index,40
2007,2007_16_5,"ACADEMIC QUALITY, POWER, AND STABILITY: AN APPLICATION TO ECONOMICS IN THE REPUBLIC OF IRELAND",0
2007,2007_16_6,State and perspectives of national and international animal research,0
2007,2007_16_7,Dynamics of message interchange between stochastic units in the contexts of human communication behaviour and spiking neurons,0
2007,2007_16_8,12th International Conference on High Pressure Semiconductor Physics (HPSP?12): Concluding remarks,0
2007,2007_16_9,Centres of Research Excellence in Economics in the Republic of Ireland. WP180. May 2007,0
2007,2007_16_10,A Robust Benchmark for the h- and g-Indexes,13
2007,2007_17_1,"CONSOLIDER-INGENIO 2010, 2007 CALL Second phase Technical Report of the Research Activity Programme Multimodal Interaction in Pattern Recognition  …",0
2007,2007_17_2,Foreword,1754
2007,2007_17_3,Selecting Scientific Papers for Publication via Citation Auctions,10
2007,2007_17_4,Academic Program Review University of New Mexico,377
2007,2007_17_5,The Structural Equation Analysis on the Journal Citation Impact in the Field of Library and Information Science.,0
2007,2007_17_6,Key Paper Expert System Using Citation Analysis,0
2007,2007_17_7,Propuesta de un modelo de baremación para las publicaciones científicas en Biomedicina,0
2007,2007_17_8,Ventajas y limitaciones sobre el uso del factor de impacto y las bases de datos del ISI como medidores de la actividad científica de un organismo público de  …,0
2007,2007_17_9,Contribuciones cortas Aporte de Cuba al estudio de Angiostrongylus cantonensis,0
2007,2007_17_10,Number of papers p,2562
2008,2008_1_1,Google Scholar as a new source for citation analysis,597
2008,2008_1_2,Universality of citation distributions: Toward an objective measure of scientific impact,483
2008,2008_1_3,"Multi-university research teams: Shifting impact, geography, and stratification in science",476
2008,2008_1_4,Are there better indices for evaluation purposes than the h index? A comparison of nine different variants of the h index using data from biomedicine,410
2008,2008_1_5,Informetrics at the beginning of the 21st century—A review,332
2008,2008_1_6,Statistical analysis of the social network and discussion threads in slashdot,269
2008,2008_1_7,Caveats for the use of citation indicators in research and journal evaluations,222
2008,2008_1_8,The citation advantage of open?access articles,227
2008,2008_1_9,Bibliometrics to webometrics,229
2008,2008_1_10,Defrosting the digital library: bibliographic tools for the next generation web,215
2008,2008_2_1,"Citation counting, citation ranking, and h?index of human?computer interaction researchers: a comparison of Scopus and Web of Science",194
2008,2008_2_2,"To share the fame in a fair way, hm modifies h for multi-authored manuscripts",156
2008,2008_2_3,Nanotechnology publications and citations by leading countries and blocs,146
2008,2008_2_4,A new methodology for ranking scientific institutions,146
2008,2008_2_5,Lost in publication: how measurement harms science,144
2008,2008_2_6,Efficient modularity optimization by multistep greedy algorithm and vertex mover refinement,145
2008,2008_2_7,Effectiveness of journal ranking schemes as a tool for locating information,140
2008,2008_2_8,An axiomatic characterization of the Hirsch-index,138
2008,2008_2_9,A modification of the h-index: The h m-index accounts for multi-authored manuscripts,130
2008,2008_2_10,Rational (successive) h-indices: An application to economics in the Republic of Ireland,125
2008,2008_3_1,Beyond the Durfee square: Enhancing the h-index to score total publication output,129
2008,2008_3_2,A citation analysis of tourism scholars,134
2008,2008_3_3,Scientists who engage with society perform better academically,128
2008,2008_3_4,"Testing the calculation of a realistic h-index in Google Scholar, Scopus, and Web of Science for FW Lancaster",120
2008,2008_3_5,An h-index weighted by citation impact,116
2008,2008_3_6,Open access scientometrics and the UK Research Assessment Exercise,113
2008,2008_3_7,Mathematical theory of the h?and g?index in case of fractional counting of authorship,117
2008,2008_3_8,The pros and cons of computing the h-index using Google Scholar,110
2008,2008_3_9,The h-index and self-citations,108
2008,2008_3_10,Generalizing the h-and g-indices,104
2008,2008_4_1,Validating research performance metrics against peer rankings,99
2008,2008_4_2,Is g-index better than h-index? An exploratory study at the individual level,96
2008,2008_4_3,Promise and pitfalls of extending Google's PageRank algorithm to citation networks,98
2008,2008_4_4,Harmonic allocation of authorship credit: Source-level correction of bibliometric bias assures accurate publication and citation analysis,93
2008,2008_4_5,A ranking of journals in economics and related fields,87
2008,2008_4_6,Ranking forestry journals using the h-index,85
2008,2008_4_7,"A rational, successive g-index applied to economics departments in Ireland",82
2008,2008_4_8,"The most highly cited Library and Information Science articles: Interdisciplinarity, first authors and citation patterns",80
2008,2008_4_9,A quantitative analysis of indicators of scientific performance,77
2008,2008_4_10,An axiomatic analysis of Egghe's g-index,78
2008,2008_5_1,Is multidisciplinary research more highly cited? A macrolevel study,78
